{
  "schema_version": "1.0",
  "issue_id": "SP-2022-Y",
  "package_id": "dialogue-interface-control",
  "draft_version": "v0.1",
  "status": "DRAFT",
  "basis": {
    "draft_package_sha256": "f499a759a7dc016c80517d1b160ca5d29ae25f17b78611d1ee34bbd7a11446ab",
    "prompt_id": "article-drafting-v0.1",
    "prompt_sha256": "c51d1be0c5ad25f564a69b0529bdefb39ccf63778aaedd1a2c5def5bd5bd943c"
  },
  "runner": {
    "provider": "OpenAI",
    "model": "GPT-5.6 Sol",
    "invocation": "interactive ChatGPT project drafting; no paid inference-provider API",
    "generated_at": "2026-08-18T07:04:15+09:00",
    "run_reference": "Interactive annual drafting by GPT-5.6 Sol after human Architecture approval on 2026-08-18 JST. Eight ARTICLE_DRAFTING overrides were authored against immutable Draft Packages; frontmatter and references remain deferred to deterministic post-draft stages."
  },
  "headline": "ChatGPTは突然の起点ではない――対話UIとcontrol layerが収束した年末",
  "deck": "2022年末のChatGPT research previewは象徴的だったが、その前にはLaMDAのdialogue modeling、helpful/harmless系RLHF、Whisperによるspeech interface、Sparrowやalignment研究、reward-modelの限界に関する検討が積み上がっていた。Constitutional AIまで含めて見ると、対話製品の成立と同時に『どう制御するか』が独立したsystem layerとして前景化したことが分かる。",
  "deck_attribution_mode": "MIXED",
  "deck_evidence_refs": [
    {
      "evidence_task_id": "evidence:SP-2022-Y:item-official-feed-bc1a61aec959b957d136-b17c3268d0",
      "kind": "CLAIM",
      "evidence_id": "claim-1"
    },
    {
      "evidence_task_id": "evidence:SP-2022-Y:series-openai-whisper-2022-a64641ea5e",
      "kind": "CLAIM",
      "evidence_id": "claim-1"
    },
    {
      "evidence_task_id": "evidence:SP-2022-Y:item-arxiv-2212-08073v1-4bc8b0350b",
      "kind": "CLAIM",
      "evidence_id": "claim-1"
    },
    {
      "evidence_task_id": "evidence:SP-2022-Y:item-arxiv-2201-08239v3-c4739f1ec9",
      "kind": "CLAIM",
      "evidence_id": "claim-1"
    }
  ],
  "blocks": [
    {
      "block_id": "preview-not-maturity",
      "block_type": "PARAGRAPH",
      "text": "ChatGPTの2022年11月公開は、後年の成熟したplatformをそのまま2022年へ持ち込んで読むべき出来事ではない。一次資料上の境界はresearch previewであり、対話UIを通じてinstruction-following modelを広い利用者へ見せたproduct-interface上の転換点として扱うのが適切である。plugin、後年のmultimodal機能、enterprise機能などをこの時点へ逆投影しないことが、2022年を歴史として読む最低条件になる。",
      "attribution_mode": "INFERENCE",
      "evidence_refs": [
        {
          "evidence_task_id": "evidence:SP-2022-Y:item-official-feed-bc1a61aec959b957d136-b17c3268d0",
          "kind": "CLAIM",
          "evidence_id": "claim-1"
        }
      ]
    },
    {
      "block_id": "dialogue-and-speech",
      "block_type": "PARAGRAPH",
      "text": "対話interfaceはChatGPTだけから始まったわけではない。LaMDAはdialogue modelを主要な研究対象として示し、Whisperはspeech recognitionを通じて音声をmodel-centered systemへ取り込む別のinterfaceを前景化した。dialogue quality、speech input/output、underlying language-model capabilityは同じ概念ではなく、利用者がmodelと相互作用するsurfaceが複数modalitiesへ広がっていたと見るべきである。",
      "attribution_mode": "MIXED",
      "evidence_refs": [
        {
          "evidence_task_id": "evidence:SP-2022-Y:item-arxiv-2201-08239v3-c4739f1ec9",
          "kind": "CLAIM",
          "evidence_id": "claim-1"
        },
        {
          "evidence_task_id": "evidence:SP-2022-Y:series-openai-whisper-2022-a64641ea5e",
          "kind": "CLAIM",
          "evidence_id": "claim-1"
        }
      ]
    },
    {
      "block_id": "alignment-to-control",
      "block_type": "PARAGRAPH",
      "text": "対話modelが利用者の指示へ直接応答するほど、alignmentは抽象的な研究agendaだけではなくproduct behaviorを決めるcontrol問題へ近付く。helpful and harmless assistantの研究、OpenAIが示したalignment research approach、DeepMindのSparrowは、それぞれ異なる方法・組織文脈から、望ましい応答と望ましくない応答をどう定義し、model behaviorへ反映するかという問題を扱った。これらを単一の安全方式とみなすのではなく、control layerを構成する複数の試みとして位置付ける。",
      "attribution_mode": "MIXED",
      "evidence_refs": [
        {
          "evidence_task_id": "evidence:SP-2022-Y:item-arxiv-2204-05862v1-ba2aa4a3ce",
          "kind": "CLAIM",
          "evidence_id": "claim-1"
        },
        {
          "evidence_task_id": "evidence:SP-2022-Y:item-official-feed-d7f602cae828f90de21d-313b211ebd",
          "kind": "CLAIM",
          "evidence_id": "claim-1"
        },
        {
          "evidence_task_id": "evidence:SP-2022-Y:item-official-index-supplemental-deepmin-72cdeb6f0a",
          "kind": "CLAIM",
          "evidence_id": "claim-1"
        }
      ]
    },
    {
      "block_id": "objective-limits",
      "block_type": "PARAGRAPH",
      "text": "controlをobjectiveへ落とし込めば問題が解けるわけでもない。reward-model overoptimizationを扱う研究は、proxy objectiveを強く最適化すること自体が別の失敗要因になり得るという境界を示す。Constitutional AIはrule/principleを使ってmodel behaviorを形成する別の方向を提示した。helpfulness/harmlessness、reward signal、明示的なruleという異なるcontrol surfaceが年内に並んだことは、強い対話modelの運用がmodel weightsだけの問題ではないことを示している。",
      "attribution_mode": "MIXED",
      "evidence_refs": [
        {
          "evidence_task_id": "evidence:SP-2022-Y:series-openai-reward-overopt-2022-31125dc229",
          "kind": "CLAIM",
          "evidence_id": "claim-1"
        },
        {
          "evidence_task_id": "evidence:SP-2022-Y:item-arxiv-2212-08073v1-4bc8b0350b",
          "kind": "CLAIM",
          "evidence_id": "claim-1"
        },
        {
          "evidence_task_id": "evidence:SP-2022-Y:item-arxiv-2204-05862v1-ba2aa4a3ce",
          "kind": "CLAIM",
          "evidence_id": "claim-1"
        }
      ]
    },
    {
      "block_id": "convergence",
      "block_type": "PARAGRAPH",
      "text": "この流れの上にChatGPTを置くと、2022年末は『突然チャットボットが現れた』瞬間ではなく、それまで別々に見えていたinstruction-following、dialogue modeling、speech interface、RLHF、安全規則、reward objectiveの問題が、利用者向け対話UIの周囲で一つのsystemとして見え始めた境界になる。能力、interface、controlを分けて読むことで、2023年以降のproduct competitionへ何が引き継がれたのかも整理しやすくなる。",
      "attribution_mode": "MIXED",
      "evidence_refs": [
        {
          "evidence_task_id": "evidence:SP-2022-Y:item-official-feed-bc1a61aec959b957d136-b17c3268d0",
          "kind": "CLAIM",
          "evidence_id": "claim-1"
        },
        {
          "evidence_task_id": "evidence:SP-2022-Y:series-openai-whisper-2022-a64641ea5e",
          "kind": "CLAIM",
          "evidence_id": "claim-1"
        },
        {
          "evidence_task_id": "evidence:SP-2022-Y:item-arxiv-2212-08073v1-4bc8b0350b",
          "kind": "CLAIM",
          "evidence_id": "claim-1"
        },
        {
          "evidence_task_id": "evidence:SP-2022-Y:item-arxiv-2201-08239v3-c4739f1ec9",
          "kind": "CLAIM",
          "evidence_id": "claim-1"
        },
        {
          "evidence_task_id": "evidence:SP-2022-Y:item-arxiv-2204-05862v1-ba2aa4a3ce",
          "kind": "CLAIM",
          "evidence_id": "claim-1"
        },
        {
          "evidence_task_id": "evidence:SP-2022-Y:item-official-index-supplemental-deepmin-72cdeb6f0a",
          "kind": "CLAIM",
          "evidence_id": "claim-1"
        },
        {
          "evidence_task_id": "evidence:SP-2022-Y:item-official-feed-d7f602cae828f90de21d-313b211ebd",
          "kind": "CLAIM",
          "evidence_id": "claim-1"
        },
        {
          "evidence_task_id": "evidence:SP-2022-Y:series-openai-reward-overopt-2022-31125dc229",
          "kind": "CLAIM",
          "evidence_id": "claim-1"
        }
      ]
    },
    {
      "block_id": "control-boundary",
      "block_type": "CLAIM_BOUNDARY",
      "text": "各組織・各論文が示したhelpfulness、harmlessness、安全性、性能、reward挙動は、それぞれの評価条件に帰属する。本稿はそれらを独立に再現した安全性ランキングへ換算せず、research agenda、deployed interface、rule/reward-based controlの状態を分けて記述する。",
      "attribution_mode": "INFERENCE",
      "evidence_refs": [
        {
          "evidence_task_id": "evidence:SP-2022-Y:item-arxiv-2212-08073v1-4bc8b0350b",
          "kind": "LIMITATION",
          "evidence_id": "limitation-1"
        },
        {
          "evidence_task_id": "evidence:SP-2022-Y:series-openai-reward-overopt-2022-31125dc229",
          "kind": "LIMITATION",
          "evidence_id": "limitation-1"
        }
      ]
    }
  ],
  "must_cover_coverage": [
    {
      "requirement": "research preview versus general product maturity",
      "block_ids": [
        "preview-not-maturity"
      ]
    },
    {
      "requirement": "speech/dialogue interface versus underlying model capability",
      "block_ids": [
        "dialogue-and-speech"
      ]
    },
    {
      "requirement": "alignment research agenda versus deployed controls",
      "block_ids": [
        "alignment-to-control"
      ]
    },
    {
      "requirement": "helpfulness/harmlessness, rule-based control and reward-model limitations",
      "block_ids": [
        "objective-limits"
      ]
    }
  ],
  "boundary_coverage": [
    {
      "requirement": "Primary-source verification establishes the bounded facts recorded here; it does not convert vendor, project, or author evaluations into independent reproduction.",
      "block_ids": [
        "control-boundary"
      ]
    }
  ],
  "late_breaking_acknowledged": false
}
